{
  "$schema": "https://json-schema.org/draft/2020-12/schema",
  "$id": "https://aegissec.example/schemas/aegis_canonical_vulnerability_intelligence.schema.json",
  "title": "AegisSec Canonical Vulnerability Intelligence Record",
  "type": "object",
  "additionalProperties": false,
  "required": [
    "schema_version",
    "record_id",
    "generated_at",
    "target",
    "source_run",
    "identifiers",
    "vulnerability",
    "exploitation",
    "package_evidence",
    "source_assertions",
    "adjacent_vulnerabilities",
    "field_provenance",
    "correlation_controls",
    "freshness",
    "quality",
    "affectedness_decision",
    "production_readiness"
  ],
  "$defs": {
    "sha256": {
      "type": "string",
      "pattern": "^[a-f0-9]{64}$"
    },
    "cve": {
      "type": "string",
      "pattern": "^CVE-[0-9]{4}-[0-9]{4,}$"
    },
    "component": {
      "type": "object",
      "additionalProperties": false,
      "required": ["package_name", "ecosystem", "version"],
      "properties": {
        "package_name": {"type": "string", "minLength": 1, "maxLength": 500},
        "ecosystem": {"type": "string", "minLength": 1, "maxLength": 100},
        "version": {"type": "string", "minLength": 1, "maxLength": 200}
      }
    },
    "sourceInventory": {
      "type": "object",
      "additionalProperties": false,
      "required": [
        "source_name",
        "source_authority",
        "source_category",
        "envelope_id",
        "payload_sha256",
        "retrieved_at",
        "validation_status",
        "all_record_ids",
        "exact_target_record_ids",
        "claim_ownership",
        "artifact_paths"
      ],
      "properties": {
        "source_name": {"enum": ["OSV", "NVD", "CISA_KEV", "FIRST_EPSS"]},
        "source_authority": {"enum": ["authoritative", "high"]},
        "source_category": {
          "enum": ["official_government", "official_public_service", "open_source_project"]
        },
        "envelope_id": {"type": "string", "pattern": "^AEG-OSI-[A-F0-9]{24}$"},
        "payload_sha256": {"$ref": "#/$defs/sha256"},
        "retrieved_at": {"type": "string", "format": "date-time"},
        "validation_status": {"enum": ["accepted", "accepted_with_warnings"]},
        "all_record_ids": {
          "type": "array",
          "uniqueItems": true,
          "items": {"type": "string", "minLength": 2, "maxLength": 300}
        },
        "exact_target_record_ids": {
          "type": "array",
          "uniqueItems": true,
          "items": {"type": "string", "minLength": 2, "maxLength": 300}
        },
        "claim_ownership": {
          "type": "array",
          "minItems": 1,
          "uniqueItems": true,
          "items": {"type": "string", "minLength": 2, "maxLength": 100}
        },
        "artifact_paths": {
          "type": "object",
          "additionalProperties": false,
          "required": ["envelope", "payload", "integrity"],
          "properties": {
            "envelope": {"type": "string", "minLength": 1},
            "payload": {"type": "string", "minLength": 1},
            "integrity": {"type": "string", "minLength": 1}
          }
        }
      }
    },
    "difference": {
      "type": "object",
      "additionalProperties": false,
      "required": ["field", "classification", "blocking", "assertions", "disposition"],
      "properties": {
        "field": {"type": "string", "pattern": "^/"},
        "classification": {"type": "string", "minLength": 2, "maxLength": 100},
        "blocking": {"type": "boolean"},
        "assertions": {"type": "object"},
        "disposition": {"type": "string", "minLength": 2, "maxLength": 200}
      }
    },
    "freshnessCheck": {
      "type": "object",
      "additionalProperties": false,
      "required": [
        "check_id",
        "source_name",
        "semantic",
        "observed_at",
        "age_days",
        "max_age_days",
        "required",
        "status",
        "blocking"
      ],
      "properties": {
        "check_id": {"type": "string", "minLength": 3, "maxLength": 200},
        "source_name": {"enum": ["OSV", "NVD", "CISA_KEV", "FIRST_EPSS"]},
        "semantic": {"type": "string", "minLength": 2, "maxLength": 100},
        "observed_at": {"type": ["string", "null"], "format": "date-time"},
        "age_days": {"type": ["number", "null"], "minimum": 0},
        "max_age_days": {"type": ["number", "null"], "minimum": 0},
        "required": {"type": "boolean"},
        "status": {"enum": ["CURRENT", "STALE", "MISSING", "NOT_OBSERVED", "OBSERVED"]},
        "blocking": {"type": "boolean"}
      }
    },
    "qualityGate": {
      "type": "object",
      "additionalProperties": false,
      "required": ["gate_id", "metric", "observed", "expected", "pass"],
      "properties": {
        "gate_id": {"type": "string", "pattern": "^M12B-[A-Z0-9-]+$"},
        "metric": {"type": "string", "minLength": 2, "maxLength": 200},
        "observed": {},
        "expected": {},
        "pass": {"type": "boolean"}
      }
    }
  },
  "properties": {
    "schema_version": {"const": "1.0.0"},
    "record_id": {"type": "string", "pattern": "^AEG-CVI-[A-F0-9]{24}$"},
    "generated_at": {"type": "string", "format": "date-time"},
    "target": {
      "type": "object",
      "additionalProperties": false,
      "required": ["cve_id", "component"],
      "properties": {
        "cve_id": {"$ref": "#/$defs/cve"},
        "component": {"$ref": "#/$defs/component"}
      }
    },
    "source_run": {
      "type": "object",
      "additionalProperties": false,
      "required": ["run_id", "retrieved_at", "summary_path", "summary_sha256", "network_used"],
      "properties": {
        "run_id": {"type": "string", "pattern": "^AEG-M12-OFFICIAL-[0-9]{8}T[0-9]{6}Z$"},
        "retrieved_at": {"type": "string", "format": "date-time"},
        "summary_path": {"type": "string", "minLength": 1},
        "summary_sha256": {"$ref": "#/$defs/sha256"},
        "network_used": {"const": true}
      }
    },
    "identifiers": {
      "type": "object",
      "additionalProperties": false,
      "required": ["primary_cve", "aliases"],
      "properties": {
        "primary_cve": {"$ref": "#/$defs/cve"},
        "aliases": {
          "type": "array",
          "uniqueItems": true,
          "items": {"type": "string", "minLength": 3, "maxLength": 300}
        }
      }
    },
    "vulnerability": {
      "type": "object",
      "additionalProperties": false,
      "required": [
        "title",
        "description",
        "status",
        "published_at",
        "last_modified_at",
        "weaknesses",
        "severity"
      ],
      "properties": {
        "title": {"type": "string", "minLength": 1, "maxLength": 1000},
        "description": {"type": ["string", "null"], "maxLength": 50000},
        "status": {"type": ["string", "null"], "maxLength": 100},
        "published_at": {"type": ["string", "null"]},
        "last_modified_at": {"type": ["string", "null"]},
        "weaknesses": {
          "type": "array",
          "uniqueItems": true,
          "items": {"type": "string", "pattern": "^CWE-[0-9]+$"}
        },
        "severity": {
          "type": "object",
          "additionalProperties": false,
          "required": ["selected", "assertions"],
          "properties": {
            "selected": {"type": ["object", "null"]},
            "assertions": {"type": "array", "items": {"type": "object"}}
          }
        }
      }
    },
    "exploitation": {
      "type": "object",
      "additionalProperties": false,
      "required": ["kev", "epss", "ssvc_assertions"],
      "properties": {
        "kev": {
          "type": "object",
          "additionalProperties": false,
          "required": [
            "status",
            "listed",
            "date_added",
            "due_date",
            "known_ransomware_campaign_use",
            "required_action",
            "vendor_project",
            "product"
          ],
          "properties": {
            "status": {"enum": ["LISTED", "NOT_LISTED"]},
            "listed": {"type": "boolean"},
            "date_added": {"type": ["string", "null"]},
            "due_date": {"type": ["string", "null"]},
            "known_ransomware_campaign_use": {"type": ["string", "null"]},
            "required_action": {"type": ["string", "null"], "maxLength": 10000},
            "vendor_project": {"type": ["string", "null"], "maxLength": 500},
            "product": {"type": ["string", "null"], "maxLength": 500}
          }
        },
        "epss": {
          "type": "object",
          "additionalProperties": false,
          "required": ["status", "cve_id", "probability", "percentile", "score_date"],
          "properties": {
            "status": {"enum": ["PRESENT", "MISSING"]},
            "cve_id": {"$ref": "#/$defs/cve"},
            "probability": {"type": ["number", "null"], "minimum": 0, "maximum": 1},
            "percentile": {"type": ["number", "null"], "minimum": 0, "maximum": 1},
            "score_date": {"type": ["string", "null"], "format": "date"}
          }
        },
        "ssvc_assertions": {"type": "array", "items": {"type": "object"}}
      }
    },
    "package_evidence": {
      "type": "object",
      "additionalProperties": false,
      "required": ["source", "exact_target_record_ids", "assertions", "aggregate_status"],
      "properties": {
        "source": {"const": "OSV"},
        "exact_target_record_ids": {
          "type": "array",
          "uniqueItems": true,
          "items": {"type": "string", "minLength": 3, "maxLength": 300}
        },
        "assertions": {
          "type": "array",
          "items": {
            "type": "object",
            "additionalProperties": false,
            "required": [
              "ecosystem",
              "package_name",
              "purl",
              "explicit_version_match",
              "range_evaluations",
              "fixed_versions",
              "evidence_status",
              "affected_index",
              "source_record_id"
            ],
            "properties": {
              "ecosystem": {"type": ["string", "null"]},
              "package_name": {"type": ["string", "null"]},
              "purl": {"type": ["string", "null"]},
              "explicit_version_match": {"type": "boolean"},
              "range_evaluations": {"type": "array", "items": {"type": "object"}},
              "fixed_versions": {
                "type": "array",
                "uniqueItems": true,
                "items": {"type": "string"}
              },
              "evidence_status": {
                "enum": ["AFFECTED_SUPPORTED", "NOT_AFFECTED_SUPPORTED", "SOURCE_QUERY_MATCH_ONLY"]
              },
              "affected_index": {"type": "integer", "minimum": 0},
              "source_record_id": {"type": "string", "minLength": 3, "maxLength": 300}
            }
          }
        },
        "aggregate_status": {
          "enum": [
            "AFFECTED_SUPPORTED",
            "NOT_AFFECTED_SUPPORTED",
            "SOURCE_QUERY_MATCH_ONLY",
            "NO_EXACT_TARGET_MATCH"
          ]
        }
      }
    },
    "source_assertions": {
      "type": "array",
      "minItems": 4,
      "maxItems": 4,
      "items": {"$ref": "#/$defs/sourceInventory"}
    },
    "adjacent_vulnerabilities": {
      "type": "array",
      "items": {
        "type": "object",
        "additionalProperties": false,
        "required": [
          "record_index",
          "record_id",
          "aliases",
          "summary",
          "published_at",
          "last_modified_at",
          "reason"
        ],
        "properties": {
          "record_index": {"type": "integer", "minimum": 0},
          "record_id": {"type": "string", "minLength": 3},
          "aliases": {"type": "array", "uniqueItems": true, "items": {"type": "string"}},
          "summary": {"type": ["string", "null"]},
          "published_at": {"type": ["string", "null"]},
          "last_modified_at": {"type": ["string", "null"]},
          "reason": {"const": "COMPONENT_VERSION_MATCH_WITHOUT_TARGET_CVE_ALIAS"}
        }
      }
    },
    "field_provenance": {
      "type": "array",
      "minItems": 10,
      "items": {
        "type": "object",
        "additionalProperties": false,
        "required": [
          "field_path",
          "source_name",
          "source_record_id",
          "source_authority",
          "source_envelope_id",
          "source_artifact_sha256",
          "source_pointer",
          "retrieved_at",
          "extraction_method",
          "value_sha256"
        ],
        "properties": {
          "field_path": {"type": "string", "pattern": "^/"},
          "source_name": {"enum": ["RUN_INPUT", "OSV", "NVD", "CISA_KEV", "FIRST_EPSS"]},
          "source_record_id": {"type": "string", "minLength": 2, "maxLength": 300},
          "source_authority": {"enum": ["declared_input", "authoritative", "high"]},
          "source_envelope_id": {
            "type": ["string", "null"],
            "pattern": "^AEG-OSI-[A-F0-9]{24}$"
          },
          "source_artifact_sha256": {"$ref": "#/$defs/sha256"},
          "source_pointer": {"type": "string", "pattern": "^/"},
          "retrieved_at": {"type": "string", "format": "date-time"},
          "extraction_method": {"type": "string", "minLength": 2, "maxLength": 200},
          "value_sha256": {"$ref": "#/$defs/sha256"}
        }
      }
    },
    "correlation_controls": {
      "type": "object",
      "additionalProperties": false,
      "required": [
        "exact_target_correlation_required",
        "source_count_is_consensus",
        "consensus_inference_permitted",
        "adjacent_record_isolation",
        "missing_numeric_values_coerced_to_zero",
        "exact_target_matches",
        "conflicts",
        "assertion_differences"
      ],
      "properties": {
        "exact_target_correlation_required": {"const": true},
        "source_count_is_consensus": {"const": false},
        "consensus_inference_permitted": {"const": false},
        "adjacent_record_isolation": {"const": true},
        "missing_numeric_values_coerced_to_zero": {"const": false},
        "exact_target_matches": {
          "type": "object",
          "additionalProperties": false,
          "required": ["OSV", "NVD", "CISA_KEV", "FIRST_EPSS"],
          "properties": {
            "OSV": {"type": "array", "uniqueItems": true, "items": {"type": "string"}},
            "NVD": {"type": "array", "uniqueItems": true, "items": {"type": "string"}},
            "CISA_KEV": {"type": "array", "uniqueItems": true, "items": {"type": "string"}},
            "FIRST_EPSS": {"type": "array", "uniqueItems": true, "items": {"type": "string"}}
          }
        },
        "conflicts": {"type": "array", "items": {"$ref": "#/$defs/difference"}},
        "assertion_differences": {"type": "array", "items": {"$ref": "#/$defs/difference"}}
      }
    },
    "freshness": {
      "type": "object",
      "additionalProperties": false,
      "required": ["reference_time", "checks", "blocking_findings"],
      "properties": {
        "reference_time": {"type": "string", "format": "date-time"},
        "checks": {"type": "array", "minItems": 7, "items": {"$ref": "#/$defs/freshnessCheck"}},
        "blocking_findings": {
          "type": "array",
          "uniqueItems": true,
          "items": {"type": "string"}
        }
      }
    },
    "quality": {
      "type": "object",
      "additionalProperties": false,
      "required": ["source_bundle_verification", "quality_gates", "warnings", "limitations"],
      "properties": {
        "source_bundle_verification": {"const": "PASS"},
        "quality_gates": {"type": "array", "minItems": 8, "items": {"$ref": "#/$defs/qualityGate"}},
        "warnings": {"type": "array", "items": {"type": "string", "maxLength": 2000}},
        "limitations": {"type": "array", "minItems": 5, "items": {"type": "string", "maxLength": 2000}}
      }
    },
    "affectedness_decision": {
      "type": "object",
      "additionalProperties": false,
      "required": ["status", "reason"],
      "properties": {
        "status": {"const": "NOT_EVALUATED"},
        "reason": {"type": "string", "minLength": 20, "maxLength": 2000}
      }
    },
    "production_readiness": {"const": "BLOCKED"}
  }
}
