{
  "adjacent_vulnerabilities": [
    {
      "aliases": [
        "CVE-2026-34480"
      ],
      "last_modified_at": "2026-04-16T11:29:10.536806482Z",
      "published_at": "2026-04-10T18:31:17Z",
      "reason": "COMPONENT_VERSION_MATCH_WITHOUT_TARGET_CVE_ALIAS",
      "record_id": "GHSA-3pxv-7cmr-fjr4",
      "record_index": 0,
      "summary": "Apache Log4j Core: Silent log event loss in XmlLayout due to unescaped XML 1.0 forbidden characters"
    },
    {
      "aliases": [
        "CVE-2026-34477"
      ],
      "last_modified_at": "2026-04-17T12:29:10.521430176Z",
      "published_at": "2026-04-10T18:31:17Z",
      "reason": "COMPONENT_VERSION_MATCH_WITHOUT_TARGET_CVE_ALIAS",
      "record_id": "GHSA-6hg6-v5c8-fphq",
      "record_index": 1,
      "summary": "Apache Log4j Core: `verifyHostName` attribute silently ignored in TLS configuration"
    },
    {
      "aliases": [
        "CVE-2021-45046"
      ],
      "last_modified_at": "2025-10-22T19:37:53.742023Z",
      "published_at": "2021-12-14T18:01:28Z",
      "reason": "COMPONENT_VERSION_MATCH_WITHOUT_TARGET_CVE_ALIAS",
      "record_id": "GHSA-7rjr-3q55-vv33",
      "record_index": 2,
      "summary": "Incomplete fix for Apache Log4j vulnerability"
    },
    {
      "aliases": [
        "CVE-2021-44832"
      ],
      "last_modified_at": "2026-06-09T10:45:14.253296471Z",
      "published_at": "2022-01-04T16:14:20Z",
      "reason": "COMPONENT_VERSION_MATCH_WITHOUT_TARGET_CVE_ALIAS",
      "record_id": "GHSA-8489-44mv-ggj8",
      "record_index": 3,
      "summary": "Improper Input Validation and Injection in Apache Log4j2"
    },
    {
      "aliases": [
        "CVE-2021-45105"
      ],
      "last_modified_at": "2026-06-09T10:30:14.432177927Z",
      "published_at": "2021-12-18T18:00:07Z",
      "reason": "COMPONENT_VERSION_MATCH_WITHOUT_TARGET_CVE_ALIAS",
      "record_id": "GHSA-p6xc-xr62-6r2g",
      "record_index": 5,
      "summary": "Apache Log4j2 vulnerable to Improper Input Validation and Uncontrolled Recursion"
    },
    {
      "aliases": [
        "CVE-2025-68161"
      ],
      "last_modified_at": "2026-02-04T03:10:00.616806Z",
      "published_at": "2025-12-18T21:31:44Z",
      "reason": "COMPONENT_VERSION_MATCH_WITHOUT_TARGET_CVE_ALIAS",
      "record_id": "GHSA-vc5p-v9hr-52mj",
      "record_index": 6,
      "summary": "Apache Log4j does not verify the TLS hostname in its Socket Appender"
    }
  ],
  "affectedness_decision": {
    "reason": "Milestone 12B prepares source-governed evidence. Affectedness must be adjudicated in the next controlled stage.",
    "status": "NOT_EVALUATED"
  },
  "correlation_controls": {
    "adjacent_record_isolation": true,
    "assertion_differences": [
      {
        "assertions": {
          "CISA_KEV": [
            "CWE-20",
            "CWE-400",
            "CWE-502"
          ],
          "NVD": [
            "CWE-20",
            "CWE-400",
            "CWE-502",
            "CWE-917"
          ],
          "OSV": [
            "CWE-20",
            "CWE-400",
            "CWE-502",
            "CWE-917"
          ]
        },
        "blocking": false,
        "classification": "SOURCE_COVERAGE_DIFFERENCE",
        "disposition": "UNION_WITH_FIELD_LEVEL_PROVENANCE",
        "field": "/vulnerability/weaknesses"
      }
    ],
    "conflicts": [],
    "consensus_inference_permitted": false,
    "exact_target_correlation_required": true,
    "exact_target_matches": {
      "CISA_KEV": [
        "CVE-2021-44228"
      ],
      "FIRST_EPSS": [
        "CVE-2021-44228"
      ],
      "NVD": [
        "CVE-2021-44228"
      ],
      "OSV": [
        "GHSA-jfh8-c2jp-5v3q"
      ]
    },
    "missing_numeric_values_coerced_to_zero": false,
    "source_count_is_consensus": false
  },
  "exploitation": {
    "epss": {
      "cve_id": "CVE-2021-44228",
      "percentile": 1.0,
      "probability": 0.99999,
      "score_date": "2026-07-15",
      "status": "PRESENT"
    },
    "kev": {
      "date_added": "2021-12-10",
      "due_date": "2021-12-24",
      "known_ransomware_campaign_use": "Known",
      "listed": true,
      "product": "Log4j2",
      "required_action": "For all affected software assets for which updates exist, the only acceptable remediation actions are: 1) Apply updates; OR 2) remove affected assets from agency networks. Temporary mitigations using one of the measures provided at https://www.cisa.gov/uscert/ed-22-02-apache-log4j-recommended-mitigation-measures are only acceptable until updates are available.",
      "status": "LISTED",
      "vendor_project": "Apache"
    },
    "ssvc_assertions": [
      {
        "data": {
          "id": "CVE-2021-44228",
          "options": [
            {
              "exploitation": "active"
            },
            {
              "automatable": "yes"
            },
            {
              "technicalImpact": "total"
            }
          ],
          "role": "CISA Coordinator",
          "timestamp": "2025-02-04T14:25:34.416117Z",
          "version": "2.0.3"
        },
        "metric_family": "ssvcV203",
        "metric_index": 0,
        "source": "134c704f-9b21-4f2e-91b3-4a467353bcc0"
      }
    ]
  },
  "field_provenance": [
    {
      "extraction_method": "validated_run_input",
      "field_path": "/target/cve_id",
      "retrieved_at": "2026-07-15T14:09:14.494975+00:00",
      "source_artifact_sha256": "60b5017c9cd42838f85aae29686e30c0a40794d0c8dd931ee0bb6c494d08bcd9",
      "source_authority": "declared_input",
      "source_envelope_id": null,
      "source_name": "RUN_INPUT",
      "source_pointer": "/requested_cve_ids",
      "source_record_id": "AEG-M12-OFFICIAL-20260715T140914Z",
      "value_sha256": "36910f32dc2ac89a6f16b1f9493efac05ba904b60f3fa901a2bb4f3ff7af05ec"
    },
    {
      "extraction_method": "validated_run_input",
      "field_path": "/target/component",
      "retrieved_at": "2026-07-15T14:09:14.494975+00:00",
      "source_artifact_sha256": "60b5017c9cd42838f85aae29686e30c0a40794d0c8dd931ee0bb6c494d08bcd9",
      "source_authority": "declared_input",
      "source_envelope_id": null,
      "source_name": "RUN_INPUT",
      "source_pointer": "/component",
      "source_record_id": "AEG-M12-OFFICIAL-20260715T140914Z",
      "value_sha256": "6152725ea2240377f80768295312870acced335982610db5a7b383001976d42c"
    },
    {
      "extraction_method": "deterministic_field_extraction",
      "field_path": "/identifiers/primary_cve",
      "retrieved_at": "2026-07-15T14:09:14.494975+00:00",
      "source_artifact_sha256": "6d484b4269c545a949da005e72df0a69de5b0aa488082b5cfc80aa8a36b18772",
      "source_authority": "authoritative",
      "source_envelope_id": "AEG-OSI-DA909188A1571952D82F13EE",
      "source_name": "NVD",
      "source_pointer": "/vulnerabilities/0/cve/id",
      "source_record_id": "CVE-2021-44228",
      "value_sha256": "36910f32dc2ac89a6f16b1f9493efac05ba904b60f3fa901a2bb4f3ff7af05ec"
    },
    {
      "extraction_method": "deterministic_field_extraction",
      "field_path": "/vulnerability/description",
      "retrieved_at": "2026-07-15T14:09:14.494975+00:00",
      "source_artifact_sha256": "6d484b4269c545a949da005e72df0a69de5b0aa488082b5cfc80aa8a36b18772",
      "source_authority": "authoritative",
      "source_envelope_id": "AEG-OSI-DA909188A1571952D82F13EE",
      "source_name": "NVD",
      "source_pointer": "/vulnerabilities/0/cve/descriptions",
      "source_record_id": "CVE-2021-44228",
      "value_sha256": "68f33bc1e214fa81880578527218475f8e33c42ceabe74ef47024fbc62abda0b"
    },
    {
      "extraction_method": "deterministic_field_extraction",
      "field_path": "/vulnerability/status",
      "retrieved_at": "2026-07-15T14:09:14.494975+00:00",
      "source_artifact_sha256": "6d484b4269c545a949da005e72df0a69de5b0aa488082b5cfc80aa8a36b18772",
      "source_authority": "authoritative",
      "source_envelope_id": "AEG-OSI-DA909188A1571952D82F13EE",
      "source_name": "NVD",
      "source_pointer": "/vulnerabilities/0/cve/vulnStatus",
      "source_record_id": "CVE-2021-44228",
      "value_sha256": "d1dc1220bd6b42322f7496ce6363a72aa76c0d05dca5c9f6051fc3481f0d3358"
    },
    {
      "extraction_method": "deterministic_field_extraction",
      "field_path": "/vulnerability/published_at",
      "retrieved_at": "2026-07-15T14:09:14.494975+00:00",
      "source_artifact_sha256": "6d484b4269c545a949da005e72df0a69de5b0aa488082b5cfc80aa8a36b18772",
      "source_authority": "authoritative",
      "source_envelope_id": "AEG-OSI-DA909188A1571952D82F13EE",
      "source_name": "NVD",
      "source_pointer": "/vulnerabilities/0/cve/published",
      "source_record_id": "CVE-2021-44228",
      "value_sha256": "f30e9eaeda34783e86a05ac10959f496c240e2be07ba59fdd9a7a3d125615d5c"
    },
    {
      "extraction_method": "deterministic_field_extraction",
      "field_path": "/vulnerability/last_modified_at",
      "retrieved_at": "2026-07-15T14:09:14.494975+00:00",
      "source_artifact_sha256": "6d484b4269c545a949da005e72df0a69de5b0aa488082b5cfc80aa8a36b18772",
      "source_authority": "authoritative",
      "source_envelope_id": "AEG-OSI-DA909188A1571952D82F13EE",
      "source_name": "NVD",
      "source_pointer": "/vulnerabilities/0/cve/lastModified",
      "source_record_id": "CVE-2021-44228",
      "value_sha256": "d5ad0c9f6eaef60cde3d751ed151d4da3372f2f289917b93c4ae84cb2b32c2b7"
    },
    {
      "extraction_method": "deterministic_primary_cvss_selection",
      "field_path": "/vulnerability/severity/selected",
      "retrieved_at": "2026-07-15T14:09:14.494975+00:00",
      "source_artifact_sha256": "6d484b4269c545a949da005e72df0a69de5b0aa488082b5cfc80aa8a36b18772",
      "source_authority": "authoritative",
      "source_envelope_id": "AEG-OSI-DA909188A1571952D82F13EE",
      "source_name": "NVD",
      "source_pointer": "/vulnerabilities/0/cve/metrics",
      "source_record_id": "CVE-2021-44228",